{
  "schema": 1,
  "domain": "backend-api",
  "description": "HTTP API 엔드포인트 — 계약·저장·인가",
  "axes": [
    {
      "id": "contract",
      "when": "",
      "ask": "요청·응답 스키마가 무엇인가? 필드마다 타입과 필수 여부는?",
      "source_hint": "OpenAPI 명세, 기존 엔드포인트의 DTO",
      "closed_when": "필드마다 타입·필수 여부가 고정돼 있고, 응답 예시가 **실물 한 건**이다 — 명세만 보고 적은 형태는 계약이 아니다",
      "excluded_when": "기존 계약을 그대로 쓰고 필드가 하나도 안 는다",
      "added_by": "seed — axis-patterns.md 도메인별 기본 축"
    },
    {
      "id": "error-codes",
      "when": "",
      "ask": "실패마다 어떤 코드·메시지를 주나? 클라이언트가 분기할 수 있나?",
      "source_hint": "에러 코드 카탈로그, 기존 예외 핸들러",
      "closed_when": "실패마다 코드·메시지가 있고, 클라이언트가 **분기할 수 있는 형태**인지 판정했다",
      "excluded_when": "실패 갈래가 프레임워크 기본 응답으로 충분하다 — 호출자가 그걸로 분기할 수 있음을 확인했다",
      "added_by": "seed — axis-patterns.md 도메인별 기본 축"
    },
    {
      "id": "authz",
      "when": "",
      "ask": "누가 부를 수 있나? 자원 소유자 검사는 어디서 하나?",
      "source_hint": "인증 미들웨어, 기존 엔드포인트의 가드",
      "closed_when": "누가 부를 수 있는지와 자원 소유자 검사를 **어느 레이어에서** 하는지 적혀 있다",
      "excluded_when": "인증 없이 열리는 엔드포인트이고, 그렇게 여는 근거가 적혀 있다",
      "added_by": "seed — axis-patterns.md 도메인별 기본 축(인증·인가)"
    },
    {
      "id": "validation",
      "when": "",
      "ask": "입력 검증의 경계는 어디이고 무엇을 거부하나?",
      "source_hint": "검증 라이브러리 사용 패턴",
      "closed_when": "검증 경계가 어디이고 무엇을 거부하는지, 거부가 어떤 응답으로 나가는지 적혀 있다",
      "excluded_when": "입력이 없다",
      "added_by": "seed — axis-patterns.md 도메인별 기본 축"
    },
    {
      "id": "transaction",
      "when": "쓰기가 여러 테이블에 걸치는가",
      "ask": "트랜잭션 경계가 어디인가? 부분 실패 시 무엇이 남나?",
      "source_hint": "기존 서비스 레이어의 트랜잭션 선언",
      "closed_when": "트랜잭션 경계와 **부분 실패 시 무엇이 남는지** 적혀 있다",
      "excluded_when": "쓰기가 없거나 한 테이블에 그친다",
      "added_by": "seed — axis-patterns.md 도메인별 기본 축"
    },
    {
      "id": "idempotency",
      "when": "재시도되는 쓰기인가",
      "ask": "같은 요청이 두 번 오면 어떻게 되나?",
      "source_hint": "멱등 키 처리, 유니크 제약",
      "closed_when": "같은 요청이 두 번 왔을 때의 결과가 적혀 있고, 무엇이 그것을 보장하는지(멱등 키·유니크 제약) 지목돼 있다",
      "excluded_when": "재시도되지 않는 경로이고, 호출자가 재시도하지 않음을 확인했다",
      "added_by": "seed — axis-patterns.md 도메인별 기본 축"
    },
    {
      "id": "performance",
      "when": "목록·조인 조회인가",
      "ask": "N+1이 나나? 어떤 인덱스에 기대나?",
      "source_hint": "쿼리 로그, 스키마의 인덱스 정의",
      "closed_when": "N+1 유무를 **쿼리 로그로** 확인했고 어떤 인덱스에 기대는지 적혀 있다. 추정이면 추정이라고 적는다",
      "excluded_when": "단건 조회이고 조인이 없다",
      "added_by": "seed — axis-patterns.md 도메인별 기본 축"
    },
    {
      "id": "observability",
      "when": "",
      "ask": "실패를 무엇으로 알아채나? 어떤 필드를 로깅하나?",
      "source_hint": "로깅 규약, 기존 핸들러의 로그",
      "closed_when": "실패를 무엇으로 알아채는지와 어떤 필드를 로깅하는지 적혀 있다 — 로그가 없으면 실패는 사용자 신고로만 드러난다",
      "excluded_when": "성립하기 어렵다 — 실패할 수 있는 경로가 있으면 켜진다",
      "added_by": "seed — axis-patterns.md 도메인별 기본 축(로깅·관측)"
    },
    {
      "id": "compat",
      "when": "기존 엔드포인트를 바꾸는가",
      "ask": "기존 클라이언트가 깨지나? 버전 전략은?",
      "source_hint": "호출자 목록, 배포된 클라이언트 버전",
      "closed_when": "기존 호출자를 **세어** 열거했고 각각이 깨지는지 판정했다. 깨지면 버전 전략이 적혀 있다",
      "excluded_when": "새 엔드포인트뿐이고 기존 계약을 하나도 안 바꾼다",
      "added_by": "seed — axis-patterns.md 도메인별 기본 축(하위호환)"
    }
  ]
}
